"﻿question_id","db_id","question","SQL","evidence","Comment","difficulty","Annotation"
"1306","thrombosis_prediction","How many patients diagnosed with SLE have a normal white blood cell level?","SELECT COUNT(T1.ID) FROM Patient AS T1 INNER JOIN Laboratory AS T2 ON T1.ID = T2.ID WHERE T1.Diagnosis = 'SLE' AND T2.WBC BETWEEN 3.5 AND 9","diagnosed with SLE refers to Diagnosis = 'SLE'; normal white blood cell level refers to WBC between 3.5 and 9.0;","Erroneous gold SQL. Should be COUNT(DISTINCT T1.ID) to avoid duplicate counts","simple","3"
"1281","thrombosis_prediction","Among the patients who have an abnormal level of glutamic oxaloacetic transaminase, when was the youngest of them born?","SELECT T1.Birthday FROM Patient AS T1 INNER JOIN Laboratory AS T2 ON T1.ID = T2.ID WHERE T2.GOT >= 60 ORDER BY T1.Birthday DESC LIMIT 1","abnormal level of glutamic oxaloacetic transaminase refers to GOT > = 60; youngest refers to MAX(Birthday);","","moderate",""
"1251","thrombosis_prediction","How many patients with an Ig G lower than normal has the symptom of abortion?","SELECT COUNT(DISTINCT T1.ID) FROM Patient AS T1 INNER JOIN Laboratory AS T2 ON T1.ID = T2.ID INNER JOIN Examination AS T3 ON T3.ID = T2.ID WHERE T2.IGG < 900 AND T3.Symptoms = 'abortion'","Ig G lower than normal refers to IGG < 900; symptom of abortion refers to Symptoms = 'abortion';","","moderate",""
"318","toxicology","What is the molecule id of bond id TR001_1_7?","SELECT DISTINCT T1.molecule_id FROM atom AS T1 INNER JOIN connected AS T2 ON T1.atom_id = T2.atom_id WHERE T2.bond_id = 'TR001_1_7'","","","simple",""
"297","toxicology","Among the atoms that contain element carbon, which one does not contain compound carcinogenic?","SELECT T1.atom_id FROM atom AS T1 INNER JOIN molecule AS T2 ON T1.molecule_id = T2.molecule_id WHERE T1.element = 'c' AND T2.label = '-'","label = '-' means molecules are non-carcinogenic; carbon refers to element = 'c'","Obvious syntactic error in question. ","simple","1"
"195","toxicology","What is the most common bond type?","SELECT T.bond_type FROM ( SELECT bond_type, COUNT(bond_id) FROM bond GROUP BY bond_type ORDER BY COUNT(bond_id) DESC LIMIT 1 ) AS T","most common bond type refers MAX(COUNT(bond_type))","","simple",""
"313","toxicology","How many atoms belong to molecule id TR005?","SELECT COUNT(T.atom_id) FROM atom AS T WHERE T.molecule_id = 'TR005'","","","simple",""
"219","toxicology","What is the percentage of carcinogenic molecules in triple type bonds?","SELECT CAST(COUNT(DISTINCT CASE WHEN T2.label = '+' THEN T2.molecule_id ELSE NULL END) AS REAL) * 100 / COUNT(DISTINCT T2.molecule_id) FROM atom AS T1 INNER JOIN molecule AS T2 ON T1.molecule_id = T2.molecule_id INNER JOIN bond AS T3 ON T2.molecule_id = T3.molecule_id WHERE T3.bond_type = '#'","label = '+' mean molecules are carcinogenic; triple bond refers to bond_type = '#'; percentage = DIVIDE(SUM(bond_type = '#'), COUNT(bond_id)) as percent where label = '+'","","challenging",""
"280","toxicology","Enumerate the bond ID of triple bond type molecules and tell me if they are carcinogenic or not.","SELECT DISTINCT T1.bond_id, T2.label FROM bond AS T1 INNER JOIN molecule AS T2 ON T1.molecule_id = T2.molecule_id WHERE T1.bond_type = '#'","triple bond refers to bond_type = '#'; label = '+' mean molecules are carcinogenic; label = '-' means molecules are non-carcinogenic","","moderate",""
"234","toxicology","How many bonds which involved atom 12 does molecule TR009 have?","SELECT COUNT(T2.bond_id) FROM bond AS T1 INNER JOIN connected AS T2 ON T1.bond_id = T2.bond_id WHERE T1.molecule_id = 'TR009' AND T2.atom_id = T1.molecule_id || '_1' AND T2.atom_id2 = T1.molecule_id || '_2'","TR009 is the molecule id; molecule_id = 'TR009' means the bond_id LIKE 'TR009_%'; involved atom 12 refers to atom_id = 'TR009_12' or atom_id2 = 'TR009_12'","Erroneous gold SQL. Should be SELECT COUNT(T2.bond_id) FROM bond AS T1 INNER JOIN connected AS T2 ON T1.bond_id = T2.bond_id WHERE T1.molecule_id = 'TR009' AND T2.atom_id = T1.molecule_id || '_12' OR T2.atom_id2 = T1.molecule_id || '_12';","moderate","3"
"221","toxicology","What are the atoms that are bonded in the molecule TR001 with the bond ID of TR001_2_6?","SELECT SUBSTR(T.bond_id, 1, 7) AS atom_id1 , T.molecule_id || SUBSTR(T.bond_id, 8, 2) AS atom_id2 FROM bond AS T WHERE T.molecule_id = 'TR001' AND T.bond_id = 'TR001_2_6'","TR001 is the molecule id; TR001_2_6 is the bond id","","simple",""
"323","toxicology","Is molecule TR000 is carcinogenic or not?","SELECT label FROM molecule AS T WHERE T.molecule_id = 'TR000'","label = '+' mean molecules are carcinogenic; label = '-' means molecules are non-carcinogenic","","simple",""
"339","toxicology","List the atom ID of the carcinogenic molecule that contains oxygen?","SELECT T1.atom_id FROM atom AS T1 INNER JOIN molecule AS T2 ON T1.molecule_id = T2.molecule_id WHERE T1.element = 'o' AND T2.label = '+'","label = '+' mean molecules are carcinogenic; oxygen refers to element = 'o'","","simple",""
"275","toxicology","Give me the molecule ID of the double bond type.","SELECT DISTINCT T.molecule_id FROM bond AS T WHERE T.bond_type = '='","double bond refers to bond_type = ' = ';","Wrong grammatical number in the question. There are multiplemolecule Ids with the double bond type","simple","1"
"322","toxicology","What is the element of toxicology for the atom with the ID of TR000_1?","SELECT T.element FROM atom AS T WHERE T.atom_id = 'TR000_1'","atom with ID refers to atom_id; element = 'cl' means Chlorine; element = 'c' means Carbon; element = 'h' means Hydrogen; element = 'o' means Oxygen, element = 's' means Sulfur; element = 'n' means Nitrogen, element = 'p' means Phosphorus, element = 'na' means Sodium, element = 'br' means Bromine, element = 'f' means Fluorine; element = 'i' means Iodine; element = 'sn' means Tin; element = 'pb' means Lead; element = 'te' means Tellurium; element = 'ca' means Calcium","It is just ""element"", not ""element of toxicology"". Syntactical error in question. ","challenging","1"
"259","toxicology","How many elements are there for single bond molecules?","SELECT COUNT(DISTINCT T.element) FROM ( SELECT DISTINCT T2.molecule_id, T1.element FROM atom AS T1 INNER JOIN molecule AS T2 ON T1.molecule_id = T2.molecule_id INNER JOIN bond AS T3 ON T2.molecule_id = T3.molecule_id WHERE T3.bond_type = '-' ) AS T","single bond refers to bond_type = '-';","","simple","2"
"295","toxicology","How many atoms belong to the molecule that element is hydrogen and labeled with carcinogenic compound?","SELECT COUNT(T1.atom_id) AS atomnums_h FROM atom AS T1 INNER JOIN molecule AS T2 ON T1.molecule_id = T2.molecule_id WHERE T2.label = '+' AND T1.element = 'h'","label = '+' mean molecules are carcinogenic; hydrogen refers to element = h'","","simple","1"
"255","toxicology","What proportion of single bonds are carcinogenic?","SELECT CAST(COUNT(CASE WHEN T2.label = '+' THEN T1.bond_id ELSE NULL END) AS REAL) * 100 / COUNT(T1.bond_id) FROM bond AS T1 INNER JOIN molecule AS T2 ON T1.molecule_id = T2.molecule_id WHERE T1.bond_type = '-'","single bond refers to bond_type = '-'; label = '+' mean molecules are carcinogenic; proportion = DIVIDE(SUM(label = '+'), COUNT(bond_id)) where bond_type = '-'","","moderate",""
"235","toxicology","How many molecules are carcinogenic and have the bromine element?","SELECT COUNT(DISTINCT T2.molecule_id) FROM atom AS T1 INNER JOIN molecule AS T2 ON T1.molecule_id = T2.molecule_id WHERE T2.label = '+' AND T1.element = 'br'","label = '+' mean molecules are carcinogenic; have bromine element refers to element = 'br'","","simple",""
"326","toxicology","Which molecule consisted of Sulphur atom with double bond?","SELECT DISTINCT T1.molecule_id FROM atom AS T1 INNER JOIN bond AS T2 ON T1.molecule_id = T2.molecule_id WHERE T1.element = 's' AND T2.bond_type = '='","sulphur refers to element - 's'; double bond refers to bond_type = ' = ';","","simple",""
"289","toxicology","Is molecule TR151 carcinogenic?","SELECT T.label FROM molecule AS T WHERE T.molecule_id = 'TR151'","label = '+' mean molecules are carcinogenic;","","simple",""
"317","toxicology","Calculate the percentage of carcinogenic molecules which contain the Chlorine element.","SELECT COUNT(CASE WHEN T2.label = '+' AND T1.element = 'cl' THEN T2.molecule_id ELSE NULL END) * 100 / COUNT(T2.molecule_id) FROM atom AS T1 INNER JOIN molecule AS T2 ON T1.molecule_id = T2.molecule_id","label = '+' mean molecules are carcinogenic; percentage = DIVIDE(SUM(label = '+' and element = 'cl'), COUNT(molecule_id)) as percentage","If a molecule has more than one chlorine element, it is going to get counted multiple times and not just once","moderate","3"
"294","toxicology","Which bond ids are double-bond with carcinogenic compound?","SELECT T1.bond_id FROM bond AS T1 INNER JOIN molecule AS T2 ON T1.molecule_id = T2.molecule_id WHERE T2.label = '+' AND T1.bond_type = '='","label = '+' mean molecules are carcinogenic; double bond refers to bond_type = ' = ';","","simple",""
